{
  "schema_version": 1,
  "diagram_type": "workflow",
  "meta": {
    "title": "WebChat Backend Action Wake Gateway",
    "subtitle": "Every backend-bound action crosses Background start/reuse and Offscreen probe/rebuild",
    "output": "webchat-runtime-lifecycle.html"
  },
  "lanes": [
    { "id": "caller", "label": "Content Caller" },
    { "id": "background", "label": "Background Gateway" },
    { "id": "runtime_reuse", "label": "Offscreen Alive" },
    { "id": "runtime_rebuild", "label": "Offscreen Missing", "variant": "exception" },
    { "id": "diagnostic", "label": "Current Recovery Gap", "variant": "exception" }
  ],
  "phases": [
    { "id": "dispatch", "label": "Dispatch", "fromCol": 0, "toCol": 0 },
    { "id": "background_gate", "label": "Background", "fromCol": 1, "toCol": 2, "variant": "emphasis" },
    { "id": "runtime_gate", "label": "Offscreen Runtime", "fromCol": 3, "toCol": 5, "variant": "security" }
  ],
  "groups": [],
  "nodes": [
    {
      "id": "backend_action",
      "lane": "caller",
      "col": 0,
      "type": "frontend",
      "label": "Backend Action",
      "sublabel": "RPC / operation",
      "tag": "reload / AppButton"
    },
    {
      "id": "resume_action",
      "lane": "caller",
      "col": 5,
      "type": "backend",
      "label": "Resume Action",
      "sublabel": "original action",
      "tag": "after recovery"
    },
    {
      "id": "background_state",
      "lane": "background",
      "col": 1,
      "type": "security",
      "label": "Active?",
      "sublabel": "MV3 worker",
      "width": 50
    },
    {
      "id": "wake_background",
      "lane": "background",
      "col": 2,
      "type": "cloud",
      "label": "Wake",
      "sublabel": "start or reuse",
      "tag": "restore caller",
      "width": 50
    },
    {
      "id": "probe_offscreen",
      "lane": "background",
      "col": 4,
      "type": "backend",
      "label": "Probe",
      "sublabel": "physical host",
      "tag": "alive / missing",
      "width": 68
    },
    {
      "id": "reuse_runtime",
      "lane": "runtime_reuse",
      "col": 5,
      "type": "messagebus",
      "label": "Reuse Runtime",
      "sublabel": "host + Rooms",
      "tag": "keep peers"
    },
    {
      "id": "rebuild_runtime",
      "lane": "runtime_rebuild",
      "col": 5,
      "type": "cloud",
      "label": "Rebuild",
      "sublabel": "generation + bind",
      "tag": "Rooms first"
    },
    {
      "id": "rooms_empty",
      "lane": "diagnostic",
      "col": 5,
      "type": "security",
      "label": "Rooms Empty",
      "sublabel": "Refresh no-op",
      "tag": "known gap"
    }
  ],
  "edges": [
    {
      "from": "backend_action",
      "to": "background_state",
      "variant": "emphasis",
      "fromSide": "bottom",
      "toSide": "top",
      "route": "drop"
    },
    { "from": "background_state", "to": "wake_background", "variant": "emphasis" },
    {
      "from": "wake_background",
      "to": "probe_offscreen",
      "label": "restore context",
      "variant": "emphasis"
    },
    {
      "from": "probe_offscreen",
      "to": "reuse_runtime",
      "label": "alive",
      "variant": "emphasis",
      "role": "branch",
      "fromSide": "bottom",
      "toSide": "top",
      "route": "drop",
      "labelSegment": 1
    },
    {
      "from": "probe_offscreen",
      "to": "rebuild_runtime",
      "label": "missing",
      "variant": "security",
      "role": "branch",
      "fromSide": "right",
      "toSide": "right",
      "route": "outside-right",
      "labelDy": 58
    },
    {
      "from": "reuse_runtime",
      "to": "resume_action",
      "variant": "emphasis",
      "role": "return",
      "fromSide": "top",
      "toSide": "bottom",
      "route": "up-channel"
    },
    {
      "from": "rebuild_runtime",
      "to": "resume_action",
      "variant": "emphasis",
      "role": "return",
      "fromSide": "right",
      "toSide": "right",
      "route": "outside-right"
    },
    {
      "from": "rebuild_runtime",
      "to": "rooms_empty",
      "variant": "security",
      "role": "error",
      "fromSide": "bottom",
      "toSide": "top",
      "route": "drop"
    }
  ],
  "cards": [
    {
      "dot": "cyan",
      "title": "One Gateway",
      "items": [
        "Every backend-bound action enters the same wake gateway",
        "Browser reload and AppButton Refresh are only examples",
        "The original action and caller identity survive recovery",
        "OS sleep, timer pause, BFCache, and page exit are out of scope"
      ]
    },
    {
      "dot": "emerald",
      "title": "Background + Runtime",
      "items": [
        "Chrome MV3 starts or reuses the Background worker",
        "Firefox persistent Background follows the reuse path",
        "An alive Offscreen host preserves Rooms and runtime data",
        "A missing host rebuilds generation, bindings, and Rooms first"
      ]
    },
    {
      "dot": "rose",
      "title": "Known Recovery Gap",
      "items": [
        "The current rebuilt-host path restores page leases",
        "It can leave the new Runtime without Chat or World Rooms",
        "AppButton Refresh may then succeed without a domain seed",
        "Room counts can remain inconsistent across content tabs"
      ]
    }
  ]
}
